RestaurantID,Name,CuisineType,Pricing_for_2,Restaurant_Phone,OperatingHours,LocationID,ActiveFlag,OpenStatus,Locality,Restaurant_Address,Latitude,Longitude,CreatedDate,ModifiedDate
9,Kuremal Mohan Lal Kulfi Wale,"Ice Cream, Desserts",200,6644856222,8:00 AM - 16:00 PM,1,Yes,Open,"Chawri Bazar, New Delhi","526, Kucha Pati Ram, Bazar Sita Ram, Near Chawri Bazar Metro Station, Chawri Bazar, New Delhi",28.64766195,77.22699109,2021-07-20 22:36:31.347428,2024-07-29 05:21:37.388390
10,Juggernaut,"South Indian, North Indian, Fast Food, Desserts, Beverages",700,8959858303,10:00 AM - 18:00 PM,1,Yes,Open,"Kailash Colony, New Delhi","HS-16, Main Market, Kailash Colony, New Delhi",28.55293914,77.24094898,2020-12-22 03:39:13.306738,2024-06-06 00:33:14.956739
3,Dum-Pukht - ITC Maurya,"North Indian, Desserts,Beverages",5000,6192814393,9:00 AM - 19:00 PM,1,Yes,Open,"ITC Maurya, Chanakyapuri, New Delhi","ITC Maurya, Chanakyapuri, New Delhi",28.5982003,77.17366073,2020-09-09 08:19:49.487677,2023-11-13 22:18:47.623166
4,Burma Burma,"Asian, Burmese, Bubble Tea, Desserts, Salad",1600,9145897039,10:00 AM - 19:00 PM,1,Yes,Open,"Cyber Hub, DLF Cyber City, Gurgaon","Shop 6, Ground Floor, Building 8, Tower C, Cyber Hub, DLF Cyber City, Gurgaon",28.49446439,77.08853245,2020-11-07 00:44:52.824312,2023-11-19 10:08:47.342571
5,The Big Chill,"Continental, American",1500,9944856222,6:00 AM - 17:00 PM,1,Yes,Open,"Khan Market, New Delhi","68-A, Khan Market, New Delhi",28.60035007,77.22749334,2020-11-11 19:43:11.251732,2024-04-29 12:32:50.364449